{
  "case_id": "case_12",
  "dataset": "synthetic_transactions_1m",
  "seed": 212,
  "gold_claims": [
    {
      "id": "s_prov",
      "span_start": 68,
      "span_end": 140,
      "quoted_span": "assembled by the fulfilment engineering team from the order event stream",
      "type": "prose_unverifiable",
      "gold_verdict": "unverifiable"
    },
    {
      "id": "s_rows",
      "span_start": 142,
      "span_end": 182,
      "quoted_span": "The file holds exactly 1,000,000 orders.",
      "type": "row_count",
      "gold_verdict": "holds"
    },
    {
      "id": "s_sorted",
      "span_start": 183,
      "span_end": 224,
      "quoted_span": "Rows are ordered chronologically by `ts`.",
      "type": "schema",
      "gold_verdict": "holds"
    },
    {
      "id": "s_ts",
      "span_start": 239,
      "span_end": 286,
      "quoted_span": "Orders cover 1 January through 31 December 2024",
      "type": "temporal_coverage",
      "gold_verdict": "holds"
    },
    {
      "id": "s_amount",
      "span_start": 342,
      "span_end": 383,
      "quoted_span": "Order values span 5.00 to 500.00 dollars.",
      "type": "range",
      "gold_verdict": "holds"
    },
    {
      "id": "s_status",
      "span_start": 384,
      "span_end": 471,
      "quoted_span": "The `status` column takes exactly four values: PLACED, SHIPPED, DELIVERED and RETURNED.",
      "type": "category_set",
      "gold_verdict": "holds"
    },
    {
      "id": "s_channel",
      "span_start": 472,
      "span_end": 527,
      "quoted_span": "Orders arrive via three channels: web, app and express.",
      "type": "category_set",
      "gold_verdict": "holds"
    },
    {
      "id": "s_pattern",
      "span_start": 528,
      "span_end": 585,
      "quoted_span": "Every non-empty `coupon_id` matches the pattern CP-#####.",
      "type": "schema",
      "gold_verdict": "violated",
      "corruption_op": "add_category",
      "note": "introduced undocumented value 'XX-BAD-CODE' into 'coupon_id' (173 rows, all at index >= 810000)"
    },
    {
      "id": "s_share",
      "span_start": 586,
      "span_end": 647,
      "quoted_span": "Roughly 10% of orders pair a coupon with the express channel.",
      "type": "aggregate_stat",
      "gold_verdict": "violated",
      "corruption_op": "fuzzy_coarsen",
      "note": "coarsened to 'Roughly 10% of orders pair a coupon with the express channel.'; true value 14.2% is outside the \u00b12pp band"
    }
  ]
}
