{
  "case_id": "case_08",
  "dataset": "penguins",
  "seed": 208,
  "gold_claims": [
    {
      "id": "p_prov",
      "span_start": 71,
      "span_end": 161,
      "quoted_span": "collected at Palmer Station, Antarctica, by Dr. Kristen Gorman and the Palmer LTER program",
      "type": "prose_unverifiable",
      "gold_verdict": "unverifiable"
    },
    {
      "id": "p_rows",
      "span_start": 163,
      "span_end": 204,
      "quoted_span": "The table holds 344 penguin observations.",
      "type": "row_count",
      "gold_verdict": "violated",
      "corruption_op": "row_count_drift",
      "note": "duplicated first 9 rows; card still states the original count"
    },
    {
      "id": "p_species",
      "span_start": 217,
      "span_end": 268,
      "quoted_span": "Three species appear: Adelie, Chinstrap and Gentoo.",
      "type": "category_set",
      "gold_verdict": "holds"
    },
    {
      "id": "p_islands",
      "span_start": 269,
      "span_end": 334,
      "quoted_span": "Sampling covered three islands named Biscoe, Dream and Torgersen.",
      "type": "category_set",
      "gold_verdict": "holds"
    },
    {
      "id": "p_year",
      "span_start": 335,
      "span_end": 376,
      "quoted_span": "Field seasons ran from 2007 through 2009.",
      "type": "temporal_coverage",
      "gold_verdict": "holds"
    },
    {
      "id": "p_mass",
      "span_start": 377,
      "span_end": 420,
      "quoted_span": "Body mass ranges from 2,700 to 6,300 grams.",
      "type": "range",
      "gold_verdict": "holds"
    },
    {
      "id": "p_bill",
      "span_start": 421,
      "span_end": 452,
      "quoted_span": "Average bill length is 47.2 mm.",
      "type": "aggregate_stat",
      "gold_verdict": "violated",
      "corruption_op": "perturb_stat",
      "note": "claimed statistic rewritten to 'Average bill length is 47.2 mm.'; data unchanged"
    },
    {
      "id": "p_sex_nulls",
      "span_start": 595,
      "span_end": 635,
      "quoted_span": "the `sex` column is missing for 11 birds",
      "type": "null_rate",
      "gold_verdict": "violated",
      "corruption_op": "inject_nulls",
      "note": "injected 4 nulls into 'sex'; card still claims none"
    }
  ]
}
