{
  "case_id": "case_06",
  "dataset": "noaa_gsod_sample",
  "seed": 106,
  "gold_claims": [
    {
      "id": "n_prov",
      "span_start": 107,
      "span_end": 151,
      "quoted_span": "derived from ISD hourly observations by NCEI",
      "type": "prose_unverifiable",
      "gold_verdict": "unverifiable"
    },
    {
      "id": "n_rows",
      "span_start": 153,
      "span_end": 196,
      "quoted_span": "The extract contains 2,064 daily summaries.",
      "type": "row_count",
      "gold_verdict": "violated",
      "corruption_op": "row_count_drift",
      "note": "duplicated first 20 rows; card still states the original count"
    },
    {
      "id": "n_stations",
      "span_start": 197,
      "span_end": 238,
      "quoted_span": "Ten distinct stations report in this file",
      "type": "category_set",
      "gold_verdict": "holds"
    },
    {
      "id": "n_dates",
      "span_start": 282,
      "span_end": 335,
      "quoted_span": "Observations cover 1 January through 30 November 2023",
      "type": "temporal_coverage",
      "gold_verdict": "violated",
      "corruption_op": "stale_temporal",
      "note": "card coverage rewritten to 'Observations cover 1 January through 30 November 2023'; data unchanged"
    },
    {
      "id": "n_temp",
      "span_start": 425,
      "span_end": 487,
      "quoted_span": "Daily mean temperatures span -10.0 to 77.8 degrees Fahrenheit.",
      "type": "range",
      "gold_verdict": "violated",
      "corruption_op": "shift_range",
      "note": "set 2 values of 'TEMP' to 85.0, outside the documented range"
    },
    {
      "id": "n_prcp",
      "span_start": 488,
      "span_end": 539,
      "quoted_span": "Precipitation values range from 0.0 to 9.99 inches.",
      "type": "range",
      "gold_verdict": "violated",
      "corruption_op": "perturb_stat",
      "note": "claimed statistic rewritten to 'Precipitation values range from 0.0 to 9.99 inches.'; data unchanged"
    },
    {
      "id": "n_sentinel",
      "span_start": 558,
      "span_end": 621,
      "quoted_span": "Missing wind speeds are encoded as 999.9 rather than left blank",
      "type": "null_rate",
      "gold_verdict": "holds"
    }
  ]
}
